{
  "version": "1.0",
  "workspace": {"name": "Comercio Andino - arquitectura empresarial", "description": "Capacidades de negocio, aplicaciones y tecnología de un comercio con tienda online y almacenes propios"},
  "units": [
    {"id": "direccion-comercial", "name": "Dirección Comercial"},
    {"id": "ventas", "name": "Ventas", "parentId": "direccion-comercial"},
    {"id": "atencion", "name": "Atención al cliente", "parentId": "direccion-comercial"},
    {"id": "operaciones", "name": "Operaciones"},
    {"id": "logistica", "name": "Logística", "parentId": "operaciones"},
    {"id": "finanzas", "name": "Finanzas"},
    {"id": "ti", "name": "Tecnología (TI)"},
    {"id": "plataforma", "name": "Equipo Plataforma", "parentId": "ti"}
  ],
  "capabilities": [
    {"id": "gestion-comercial", "name": "Gestión comercial", "ownerId": "direccion-comercial", "importance": "core"},
    {"id": "ventas-online", "name": "Ventas online", "parentId": "gestion-comercial", "importance": "differentiating", "maturity": 4},
    {"id": "gestion-pedidos", "name": "Gestión de pedidos", "parentId": "gestion-comercial", "ownerId": "ventas", "importance": "core", "maturity": 4},
    {"id": "gestion-clientes", "name": "Gestión de clientes", "parentId": "gestion-comercial", "importance": "core", "maturity": 3},
    {"id": "precios-promociones", "name": "Precios y promociones", "parentId": "gestion-comercial", "importance": "differentiating", "maturity": 3},
    {"id": "cadena-suministro", "name": "Cadena de suministro", "ownerId": "operaciones", "importance": "core"},
    {"id": "gestion-inventario", "name": "Gestión de inventario", "parentId": "cadena-suministro", "ownerId": "logistica", "importance": "core", "maturity": 3},
    {"id": "distribucion", "name": "Distribución y entrega", "parentId": "cadena-suministro", "ownerId": "logistica", "importance": "core", "maturity": 2},
    {"id": "compras", "name": "Compras y proveedores", "parentId": "cadena-suministro", "importance": "supporting", "maturity": 3},
    {"id": "gestion-financiera", "name": "Gestión financiera", "ownerId": "finanzas", "importance": "core"},
    {"id": "facturacion", "name": "Facturación", "parentId": "gestion-financiera", "importance": "core", "maturity": 4},
    {"id": "cobros", "name": "Cobros y pagos", "parentId": "gestion-financiera", "importance": "core", "maturity": 3},
    {"id": "contabilidad", "name": "Contabilidad", "parentId": "gestion-financiera", "importance": "supporting", "maturity": 4},
    {"id": "experiencia-cliente", "name": "Experiencia del cliente", "ownerId": "atencion", "importance": "differentiating"},
    {"id": "atencion-cliente", "name": "Atención al cliente", "parentId": "experiencia-cliente", "importance": "differentiating", "maturity": 3},
    {"id": "fidelizacion", "name": "Fidelización", "parentId": "experiencia-cliente", "importance": "differentiating", "maturity": 3}
  ],
  "processes": [
    {"id": "alta-pedido", "name": "Alta de pedido", "ownerId": "ventas"},
    {"id": "devoluciones", "name": "Gestión de devoluciones", "ownerId": "atencion"},
    {"id": "cierre-mensual", "name": "Cierre contable mensual", "ownerId": "finanzas"}
  ],
  "applications": [
    {"id": "tienda-web", "name": "Tienda online", "technology": "React + Node.js", "ownerId": "ventas", "criticality": "critical"},
    {"id": "erp", "name": "ERP corporativo", "technology": "SAP S/4HANA", "vendor": "SAP", "ownerId": "finanzas", "criticality": "critical"},
    {"id": "crm", "name": "CRM", "technology": "Salesforce", "vendor": "Salesforce", "ownerId": "ventas", "criticality": "high", "external": true},
    {"id": "motor-precios", "name": "Motor de precios", "technology": "Java + Redis", "ownerId": "ventas", "criticality": "medium"},
    {"id": "wms-legacy", "name": "WMS heredado", "technology": "Oracle Forms", "ownerId": "logistica", "lifecycle": "sunset", "criticality": "high"},
    {"id": "wms-nuevo", "name": "WMS nuevo", "technology": "Java + PostgreSQL", "ownerId": "logistica", "lifecycle": "planned", "criticality": "high"},
    {"id": "tms", "name": "Gestión de transporte", "technology": "Transporeon", "vendor": "Transporeon", "ownerId": "logistica", "criticality": "medium", "external": true},
    {"id": "portal-proveedores", "name": "Portal de proveedores", "technology": "Node.js", "ownerId": "logistica", "criticality": "medium"},
    {"id": "facturacion-electronica", "name": "Facturación electrónica", "technology": "Java", "ownerId": "finanzas", "criticality": "high"},
    {"id": "pasarela-pagos", "name": "Pasarela de pagos", "technology": "Stripe", "vendor": "Stripe", "ownerId": "finanzas", "criticality": "high", "external": true},
    {"id": "contact-center", "name": "Contact center", "technology": "Genesys Cloud", "vendor": "Genesys", "ownerId": "atencion", "criticality": "medium", "external": true}
  ],
  "technologies": [
    {"id": "kubernetes", "name": "Kubernetes", "kind": "platform", "version": "1.29", "ownerId": "plataforma"},
    {"id": "aws", "name": "AWS", "kind": "infrastructure", "ownerId": "plataforma"},
    {"id": "hana", "name": "SAP HANA", "kind": "database", "version": "2.0", "ownerId": "ti", "endOfLife": "2034-12"},
    {"id": "postgres", "name": "PostgreSQL", "kind": "database", "version": "16", "ownerId": "plataforma"},
    {"id": "oracle-11g", "name": "Oracle Database", "kind": "database", "version": "11g", "ownerId": "ti", "lifecycle": "sunset"}
  ],
  "relations": [
    {"id": "tienda-web--supports--ventas-online", "kind": "supports", "sourceId": "tienda-web", "targetId": "ventas-online"},
    {"id": "tienda-web--supports--alta-pedido", "kind": "supports", "sourceId": "tienda-web", "targetId": "alta-pedido"},
    {"id": "erp--supports--alta-pedido", "kind": "supports", "sourceId": "erp", "targetId": "alta-pedido"},
    {"id": "erp--supports--gestion-pedidos", "kind": "supports", "sourceId": "erp", "targetId": "gestion-pedidos"},
    {"id": "crm--supports--gestion-clientes", "kind": "supports", "sourceId": "crm", "targetId": "gestion-clientes"},
    {"id": "crm--supports--fidelizacion", "kind": "supports", "sourceId": "crm", "targetId": "fidelizacion"},
    {"id": "motor-precios--supports--precios-promociones", "kind": "supports", "sourceId": "motor-precios", "targetId": "precios-promociones"},
    {"id": "wms-legacy--supports--gestion-inventario", "kind": "supports", "sourceId": "wms-legacy", "targetId": "gestion-inventario"},
    {"id": "wms-nuevo--supports--gestion-inventario", "kind": "supports", "sourceId": "wms-nuevo", "targetId": "gestion-inventario"},
    {"id": "tms--supports--distribucion", "kind": "supports", "sourceId": "tms", "targetId": "distribucion"},
    {"id": "portal-proveedores--supports--compras", "kind": "supports", "sourceId": "portal-proveedores", "targetId": "compras"},
    {"id": "facturacion-electronica--supports--facturacion", "kind": "supports", "sourceId": "facturacion-electronica", "targetId": "facturacion"},
    {"id": "erp--supports--facturacion", "kind": "supports", "sourceId": "erp", "targetId": "facturacion"},
    {"id": "pasarela-pagos--supports--cobros", "kind": "supports", "sourceId": "pasarela-pagos", "targetId": "cobros"},
    {"id": "erp--supports--cobros", "kind": "supports", "sourceId": "erp", "targetId": "cobros"},
    {"id": "erp--supports--contabilidad", "kind": "supports", "sourceId": "erp", "targetId": "contabilidad"},
    {"id": "erp--supports--cierre-mensual", "kind": "supports", "sourceId": "erp", "targetId": "cierre-mensual"},
    {"id": "contact-center--supports--atencion-cliente", "kind": "supports", "sourceId": "contact-center", "targetId": "atencion-cliente"},
    {"id": "contact-center--supports--devoluciones", "kind": "supports", "sourceId": "contact-center", "targetId": "devoluciones"},
    {"id": "crm--supports--devoluciones", "kind": "supports", "sourceId": "crm", "targetId": "devoluciones"},
    {"id": "alta-pedido--realizes--gestion-pedidos", "kind": "realizes", "sourceId": "alta-pedido", "targetId": "gestion-pedidos"},
    {"id": "devoluciones--realizes--atencion-cliente", "kind": "realizes", "sourceId": "devoluciones", "targetId": "atencion-cliente"},
    {"id": "cierre-mensual--realizes--contabilidad", "kind": "realizes", "sourceId": "cierre-mensual", "targetId": "contabilidad"},
    {"id": "tienda-web--runs-on--kubernetes", "kind": "runs-on", "sourceId": "tienda-web", "targetId": "kubernetes"},
    {"id": "erp--runs-on--hana", "kind": "runs-on", "sourceId": "erp", "targetId": "hana"},
    {"id": "motor-precios--runs-on--kubernetes", "kind": "runs-on", "sourceId": "motor-precios", "targetId": "kubernetes"},
    {"id": "wms-legacy--runs-on--oracle-11g", "kind": "runs-on", "sourceId": "wms-legacy", "targetId": "oracle-11g"},
    {"id": "wms-nuevo--runs-on--kubernetes", "kind": "runs-on", "sourceId": "wms-nuevo", "targetId": "kubernetes"},
    {"id": "wms-nuevo--runs-on--postgres", "kind": "runs-on", "sourceId": "wms-nuevo", "targetId": "postgres"},
    {"id": "portal-proveedores--runs-on--kubernetes", "kind": "runs-on", "sourceId": "portal-proveedores", "targetId": "kubernetes"},
    {"id": "facturacion-electronica--runs-on--kubernetes", "kind": "runs-on", "sourceId": "facturacion-electronica", "targetId": "kubernetes"},
    {"id": "facturacion-electronica--runs-on--postgres", "kind": "runs-on", "sourceId": "facturacion-electronica", "targetId": "postgres"},
    {"id": "tienda-web--depends-on--erp", "kind": "depends-on", "sourceId": "tienda-web", "targetId": "erp", "description": "stock y precios por API"},
    {"id": "tienda-web--depends-on--pasarela-pagos", "kind": "depends-on", "sourceId": "tienda-web", "targetId": "pasarela-pagos", "description": "cobro con tarjeta"},
    {"id": "tienda-web--depends-on--motor-precios", "kind": "depends-on", "sourceId": "tienda-web", "targetId": "motor-precios"},
    {"id": "facturacion-electronica--depends-on--erp", "kind": "depends-on", "sourceId": "facturacion-electronica", "targetId": "erp"},